<?xml version="1.0" encoding="UTF-8"?>
<generator xmlns="http://thinkframework.github.io/schema/generator"
       xmlns:xsi="http://www.w3.org/2001/XMLSchema-instance"
       xmlns:beans="http://www.springframework.org/schema/beans"
       xsi:schemaLocation="http://www.springframework.org/schema/beans
           http://www.springframework.org/schema/beans/spring-beans-3.2.xsd
           http://thinkframework.github.io/schema/generator
           http://thinkframework.github.io/schema/generator/think-generator.xsd" id="generator">
    <description>
        会对configuration下的所有字段生成两个节点,放到生成器上下文中
            例如: companyName会生成:
                companyName: com.glodon.bim5d
                companyName_path: com/glodon/bim5d
        packageName = companyName + appName + moduleName
    </description>
    <configuration>
        <!-- 框架包的名称 -->
        <frameName>com.glodon.bim5d</frameName>
        <!--#公司名称-->
        <companyName>com.glodon.bim5d</companyName>
        <!--#应用名称-->
        <appName>app</appName>
        <!--#模块名称-->
        <!--<moduleName>auth</moduleName>-->
        <!--<moduleName>param</moduleName>-->
        <!--            <moduleName>costenterprise</moduleName>-->
        <moduleName>costproject</moduleName>
        <!--#作者名称-->
        <!--<authorName>lixiaobin</authorName>-->
        <authorName>unascribed</authorName>
        <!--#jsp namespace: web/${namespace}/${className}/get:jsp-->
        <namespace>views</namespace>
        <!--#模板目录-->
        <!--            <template>template/glodon/enterprise</template>-->
        <!--            <template>template/glodon/project</template>-->
        <template>template/test</template>
        <!--#过滤文件-->
        <extensions>
            <list>
                <value>java</value>
                <value>js</value>
                <value>jsp</value>
                <value>xml</value>
                <value>ts</value>
                <value>html</value>
                <value>json</value>
                <value>sql</value>
            </list>
        </extensions>
        <converts>
            <map>
                <entity key="java.sql.Types.BIGINT" value="java.math.BigInteger"/>
                <!--                    <entity key="java.sql.Types.DATE" value="java.time.LocalDate"/>-->
                <!--                    <entity key="java.sql.Types.TIMESTAMP" value="java.time.Instant"/>-->
            </map>
            <!--<props>-->
            <!--<prop key="java.sql.Types.DATE">java.time.LocalDate</prop>-->
            <!--<prop key="java.sql.Types.TIMESTAMP">java.time.Instant</prop>-->
            <!--</props>-->
        </converts>
        <!--#需要移除的表名前缀,使用逗号进行分隔多个前缀,示例值: t_,tm_-->
        <prefixs>
            <list>
                <value>T_</value>
                <value>bim5d_cost_</value>
            </list>
        </prefixs>
        <!--#需要移除的表名前缀,使用逗号进行分隔多个前缀,示例值: t_,tm_-->
        <ignores>
            <list>
                <value>sys_create_time</value>
                <value>sys_modified_time</value>
                <value>sys_revision</value>
                <value>sys_creator_id</value>
                <value>sys_modifier_id</value>
            </list>
        </ignores>
        <!--#输出目录-->
        <output>out</output>
    </configuration>
</generator>
